id,content_name,is_ott,분류코드,개봉일,감독_및_PD,시청자수,platform,episode_total,episode_length,cast,origin_country,lang,rating,synopsis,poster_url,ott_availability,awards,tags
1,The Gift,N,KVARIETY_115,2015-11-01,Joel Edgerton,105918,Theater,1,108,"Busy Philipps, Allison Tolman",USA,English,19금,compulsive liar fired from a job gift,NA,NA,NA,"Mystery, Thriller"
2,Unfriended,N,MOVIE_FANTASY_DRAGON,2014-12-03,Levan Gabriadze,440679,Theater,1,83,"Shelley Hennig, Renee Olstead",USA,English,19금,blender computer screen secret,NA,NA,NA,"Horror, Mystery, Thriller"
3,Now Is Good,N,KVARIETY_099,2012-03-16,Ol Parker,126532,영화관,1,103,"Jeremy Irvine, Olivia Williams",UK,English,15세,death dying leukemia,NA,NA,NA,"Drama, Romance"
4,Exeter,N,KVARIETY_025,2015-08-02,Marcus Nispel,306626,Theater,1,91,"Ashley Tramonte, Brittany Curran",USA,English,19금,asylum demon party,NA,NA,NA,"Horror, Mystery, Thriller"
5,Khumba,N,DRAMA_SCHOOL_TEACHER,2013-07-15,Anthony Silverston,119475,영화관,1,85,"Liam Neeson, Steve Buscemi",South Africa,English,전체,herd ostrich waterhole,NA,NA,NA,"Adventure, Animation, Family"
6,Centurion,N,DRAMA_CRIME_POLICE,2010-04-24,Neil Marshall,101761,영화관,1,97,"Michael Fassbender, JJ Feild",UK,English,19금,mushroom mute roman soldier,NA,NA,NA,"Action, Adventure, Drama"
7,The Christmas Candle,N,MOVIE_ROM_GEN,2013-10-24,John Stephenson,244121,영화관,1,100,"Samantha Barks, Hans Matheson",UK,English,12세,angel candle christmas,NA,NA,NA,"Drama, Family"
8,Danny Collins,N,MOVIE_ROM_MELODRAMA,2015-11-15,Dan Fogelman,118022,Theater,1,106,"Al Pacino, Jennifer Garner",USA,English,19금,entertainer inspiration lost opportunity,NA,NA,NA,"Comedy, Drama, Music"
9,Fair Game,N,MOVIE_ANIME_CULINARY,2010-01-21,Doug Liman,565219,Theater,1,108,"Naomi Watts, Ty Burrell",USA,English,15세,bush administration cia interview,NA,NA,NA,"Biography, Drama, Thriller"
10,Legends of Oz: Dorothy's Return,N,KVARIETY_114,2013-09-18,Will Finn,239369,Theater,1,88,"Lea Michele, Oliver Platt",USA,English,12세,jester kansas oz,NA,NA,NA,"Adventure, Animation, Family"
11,My Week with Marilyn,N,KVARIETY_107,2011-11-05,Simon Curtis,515143,영화관,1,99,"Eddie Redmayne, Toby Jones",UK,English,19금,actress assistant director blonde bombshell,NA,NA,NA,"Biography, Drama"
12,Chain of Command,N,DRAMA_MEDICAL_SURGERY,2015-09-05,Kevin Carraway,392888,Theater,1,88,"Michael Jai White, Max Ryan",USA,English,19금,army michael jai white ohio,NA,NA,NA,"Action, Thriller"
13,The Past is a Grotesque Animal,N,KVARIETY_012,2014-01-03,Jason Miller,394820,Theater,1,77,"Jon Brion, Dottie Alexander",USA,English,전체,artist band male rear nudity,NA,NA,NA,"Biography, Documentary, Music"
14,Sholem Aleichem: Laughing in the Darkness,N,DRAMA_FAM_MULTIGENER,2011-02-27,Joseph Dorman,423156,Theater,1,93,"Rachel Dratch, Peter Riegert",USA,English,전체,jewish identity,NA,NA,NA,Documentary
15,Alice Through the Looking Glass,N,MOVIE_SF_ALIEN,2016-04-25,James Bobin,70718,Theater,1,113,"Johnny Depp, Alan Rickman",USA,English,12세,clock dark fantasy mad hatter,NA,NA,NA,"Adventure, Family, Fantasy"
16,Gone Girl,N,KVARIETY_166,2014-04-12,David Fincher,789310,Theater,1,149,"Patrick Fugit, Sela Ward",USA,English,19금,based on novel disappearance missing person,NA,NA,NA,"Crime, Drama, Mystery"
17,No Good Deed,N,KVARIETY_126,2014-03-19,Sam Miller,280485,Theater,1,84,"Leslie Bibb, Kate del Castillo",USA,English,15세,home invasion police officer shot police officer shot in the chest,NA,NA,NA,"Crime, Thriller"
18,House at the End of the Street,N,KVARIETY_067,2012-02-28,Mark Tonderai,429303,영화관,1,101,"Jennifer Lawrence, Nolan Gerard Funk",Canada,English,15세,brother sister relationship death of sister female protagonist,NA,NA,NA,"Drama, Horror, Thriller"
19,Parker,N,KVARIETY_157,2013-11-12,Taylor Hackford,151724,Theater,1,118,"Jason Statham, Clifton Collins Jr.",USA,English,19금,action hero disguise hospital,NA,NA,NA,"Action, Crime, Romance"
20,Maleficent,N,KVARIETY_195,2014-07-07,Robert Stromberg,555064,Theater,1,97,"Angelina Jolie Pitt, Sharlto Copley",USA,English,12세,curse dark fantasy fairy,NA,NA,NA,"Action, Adventure, Family"
21,The 5th Wave,N,MOVIE_ANIME_ROMANCE,2016-07-02,J Blakeson,245511,Theater,1,112,"Chlo?? Grace Moretz, Maggie Siff",USA,English,15세,alien attack based on novel,NA,NA,NA,"Action, Adventure, Sci-Fi"
22,Something Borrowed,N,KVARIETY_104,2011-11-04,Luke Greenfield,96264,Theater,1,112,"Ashley Williams, Steve Howey",USA,English,15세,best friend crush law school,NA,NA,NA,"Comedy, Drama, Romance"
23,Pixels,N,KVARIETY_066,2015-02-03,Chris Columbus,401393,Theater,1,106,"Peter Dinklage, Adam Sandler",USA,English,15세,alien arcade game chase,NA,NA,NA,"Action, Animation, Comedy"
24,The Diary of a Teenage Girl,N,MOVIE_DOC_SCIENCE,2015-12-10,Marielle Heller,184694,Theater,1,102,"Alexander Skarsg??rd, David Fine",USA,English,19금,1970s mother's boyfriend overalls,NA,NA,NA,"Drama, Romance"
25,Victor Frankenstein,N,KVARIETY_110,2015-10-21,Paul McGuigan,423660,Theater,1,110,"Daniel Radcliffe, Spencer Wilding",USA,English,15세,assistant experiment frankenstein,NA,NA,NA,"Drama, Horror, Sci-Fi"
26,Water for Elephants,N,DRAMA_FAM_SIBLING,2011-12-13,Francis Lawrence,119749,Theater,1,120,"Robert Pattinson, Christoph Waltz",USA,English,15세,circus circus vargas elephant,NA,NA,NA,"Drama, Romance"
27,When the Lights Went Out,N,KVARIETY_056,2012-06-14,Pat Holden,561977,영화관,1,86,"Alan Brent, Martin Compston",UK,English,전체,father daughter relationship poltergeist spirit,NA,NA,NA,Horror
28,The FP,N,DRAMA_SF_PARALLEL,2011-07-17,Brandon Trost,83543,Theater,1,82,"Clifton Collins Jr., Sean Whalen",USA,English,19금,abbreviation in title based on short film competition dancing,NA,NA,NA,Comedy
29,Supporting Characters,N,KVARIETY_101,2012-03-08,Daniel Schechter,512335,Theater,1,87,"Lena Dunham, Kevin Corrigan",USA,English,전체,film editor kiss marriage proposal,NA,NA,NA,Comedy
30,Won't Back Down,N,MOVIE_MUSIC_JAZZ,2012-05-16,Daniel Barnz,494384,Theater,1,121,"Holly Hunter, Rosie Perez",USA,English,12세,children inner city parent,NA,NA,NA,Drama
31,RED 2,N,KVARIETY_091,2013-07-14,Dean Parisot,306874,Theater,1,116,"Bruce Willis, Anthony Hopkins",USA,English,15세,cia cia agent rescue,NA,NA,NA,"Action, Comedy, Crime"
32,This Is the End,N,MOVIE_SF_DYSTOPIA,2013-03-12,Evan Goldberg,521027,Theater,1,107,"Channing Tatum, James Franco",USA,English,19금,apocalypse celebrity ensemble cast,NA,NA,NA,"Comedy, Fantasy"
33,Margaret,N,DRAMA_FAM_STEPFAMILY,2011-02-22,Kenneth Lonergan,333714,Theater,1,186,"Matt Damon, Kieran Culkin",USA,English,19금,accident bus loss of virginity,NA,NA,NA,Drama
34,Shanghai Calling,N,KDRAMA_084,2012-05-16,Daniel Hsia,351294,Theater,1,100,"Alan Ruck, Daniel Henney",USA,English,15세,A film titled Shanghai Calling.,NA,NA,NA,"Comedy, Drama, Romance"
35,Coriolanus,N,DRAMA_FANTASY_DRAGON,2011-01-24,Ralph Fiennes,157924,영화관,1,123,"Gerard Butler, Ashraf Barhom",UK,English,19금,modern day adaptation reference to william shakespeare shakespeare in modern dress,NA,NA,NA,"Drama, Thriller, War"
36,Diary of a Wimpy Kid,N,MOVIE_DOC_MEDICAL,2010-02-12,Thor Freudenthal,496088,Theater,1,94,"Chlo?? Grace Moretz, Zachary Gordon",USA,English,12세,cheese diary friend,NA,NA,NA,"Comedy, Family"
37,Child 44,N,MOVIE_ROM_BL,2015-07-08,Daniel Espinosa,160412,영화관,1,137,"Tom Hardy, Fares Fares",Czech Republic,English,19금,child murderer murder sex,NA,NA,NA,"Crime, Drama, Thriller"
38,Vacation,N,KDRAMA_032,2015-07-22,John Francis Daley,306104,Theater,1,99,"Chris Hemsworth, Norman Reedus",USA,English,19금,amusement park dysfunctional family road trip,NA,NA,NA,"Adventure, Comedy"
39,What to Expect When You're Expecting,N,KVARIETY_196,2012-02-28,Kirk Jones,432540,Theater,1,110,"Anna Kendrick, Dennis Quaid",USA,English,15세,baby expecting twins hawaiian shirt,NA,NA,NA,"Comedy, Drama, Romance"
40,Mad Max: Fury Road,N,MOVIE_ACTION_SUPERHERO,2015-06-12,George Miller,648544,영화관,1,120,"Tom Hardy, Charlize Theron",Australia,English,19금,australia desert escape,NA,NA,NA,"Action, Adventure, Sci-Fi"
41,The 33,N,KVARIETY_192,2015-11-01,Patricia Riggen,492125,영화관,1,127,"Marco Trevi?±o, James Brolin",Chile,English,15세,disaster movie mine minister,NA,NA,NA,"Biography, Drama, History"
42,The Call,N,MOVIE_CRIME_FRAUD,2013-05-12,Brad Anderson,357907,Theater,1,94,"Michael Imperioli, Tara Platt",USA,English,19금,911 operator calling 911 die hard scenario,NA,NA,NA,"Crime, Thriller"
43,Bucky Larson: Born to Be a Star,N,DRAMA_WORK_LAWENFORCEMENT,2011-08-19,Tom Brady,412935,Theater,1,97,"Don Johnson, Kevin Nealon",USA,English,19금,diner eating a banana masturbation,NA,NA,NA,Comedy
44,The Brain That Sings,N,KVARIETY_177,2013-07-03,Amal Al-Agroobi,548646,영화관,1,62,NA,United Arab Emirates,Arabic,전체,autism middle east music therapy,NA,NA,NA,"Documentary, Family"
45,Sharkskin,N,KVARIETY_160,2015-10-08,Dan Perri,400154,Theater,1,100,"Travis Myers, David Proval",USA,English,전체,A film titled Sharkskin.,NA,NA,NA,"Comedy, Drama, Mystery"
46,The Infiltrator,N,DRAMA_MEDICAL_LAW,2016-02-03,Brad Furman,591842,영화관,1,127,"Joseph Gilgun, Amy Ryan",UK,English,19금,A film titled The Infiltrator.,NA,NA,NA,"Biography, Crime, Drama"
47,Blackthorn,N,KDRAMA_077,2011-12-24,Mateo Gil,241797,영화관,1,102,"Sam Shepard, Dominique McElligott",Spain,English,19금,assumed identity bolivia butch cassidy,NA,NA,NA,"Action, Adventure, Western"
48,Furry Vengeance,N,DRAMA_CRIME_HOSTAGE,2010-10-03,Roger Kumble,386296,Theater,1,92,"Brendan Fraser, Brooke Shields",USA,English,12세,animal bear land developer,NA,NA,NA,"Comedy, Family"
49,Free Birds,N,MOVIE_DOC_ART,2013-10-15,Jimmy Hayward,250078,Theater,1,91,"Amy Poehler, Carlos Ponce",USA,English,12세,chipmunk hunting dog sabotage,NA,NA,NA,"Adventure, Animation, Comedy"
50,The Timber,N,MOVIE_ANIME_MYSTERY,2015-07-11,Anthony O'Brien,391637,Theater,1,81,"James Ransone, Maria Doyle Kennedy",USA,English,전체,A film titled The Timber.,NA,NA,NA,"Adventure, Drama, Western"
51,Area 51,N,DRAMA_ROM_NOONA,2015-03-23,Oren Peli,554636,Theater,1,91,"Glenn Campbell, Sandra Staggs",USA,English,19금,alien alien abduction conspiracy,NA,NA,NA,"Horror, Sci-Fi, Thriller"
52,The Sweeney,N,MOVIE_ACTION_GEN,2012-04-17,Nick Love,579329,영화관,1,112,"Hayley Atwell, Ray Winstone",UK,English,19금,bank criminal detective,NA,NA,NA,"Action, Crime, Drama"
53,Carnage,N,KDRAMA_022,2011-05-20,Roman Polanski,100520,영화관,1,80,"Kate Winslet, Christoph Waltz",France,English,19금,based on play meeting salesman,NA,NA,NA,"Comedy, Drama"
54,Beneath Hill 60,N,DRAMA_WORK_POLICE,2010-04-17,Jeremy Sims,265066,영화관,1,122,"Harrison Gilbertson, Gyton Grantley",Australia,English,19금,blue clay diversion ends with biographical notes,NA,NA,NA,"Drama, History, War"
55,13 Hours,N,MOVIE_COM_SLAPSTICK,2016-06-24,Michael Bay,451185,Theater,1,144,"Toby Stephens, James Badge Dale",USA,English,19금,based on true story cia agent libya,NA,NA,NA,"Action, Drama, Thriller"
56,Little Boy,N,MOVIE_ACTION_MARTIALARTS,2015-07-17,Alejandro Monteverde,313492,영화관,1,106,"Tom Wilkinson, Cary-Hiroyuki Tagawa",Mexico,English,15세,A film titled Little Boy.,NA,NA,NA,"Drama, War"
57,Iron Man 2,N,KDRAMA_026,2010-01-16,Jon Favreau,1032543,Theater,1,124,"Robert Downey Jr., Scarlett Johansson",USA,English,15세,hammer military monaco,NA,NA,NA,"Action, Adventure, Sci-Fi"
58,The World Is Mine,N,KDRAMA_055,2015-04-27,Nicolae Constantin Tanase,439906,영화관,1,104,"Iulia Ciochina, Ana Maria Guran",Romania,Romanian,전체,A film titled The World Is Mine.,NA,NA,NA,Drama
59,The Legend of Hercules,N,DRAMA_THR_POLICE,2014-02-16,Renny Harlin,446336,Theater,1,99,"Roxanne McKee, Luke Newberry",USA,English,15세,ancient greece forbidden love hercules,NA,NA,NA,"Action, Adventure, Fantasy"
60,Rodeo Girl,N,KVARIETY_034,2016-04-16,Joel Paul Reisig,598207,Theater,1,108,"Carrie Bradstreet, Joel Paul Reisig",USA,English,12세,A film titled Rodeo Girl.,NA,NA,NA,Family
61,A Lonely Place to Die,N,KDRAMA_018,2011-08-08,Julian Gilbey,444082,영화관,1,99,"Ed Speleers, Eamonn Walker",UK,English,19금,kidnapper mountaineering scotland,NA,NA,NA,"Action, Adventure, Crime"
62,A Haunted House 2,N,KDRAMA_090,2014-02-05,Michael Tiddes,73960,Theater,1,86,"Ashley Rickards, Essence Atkins",USA,English,19금,bare breasts parody sexual innuendo,NA,NA,NA,"Comedy, Fantasy"
63,Plush,N,KVARIETY_091,2013-07-25,Catherine Hardwicke,107410,Theater,1,99,"Frances Fisher, James Kyson",USA,English,19금,gay interest guitarist obsessed fan,NA,NA,NA,Thriller
64,X-Men: First Class,N,KVARIETY_055,2011-08-05,Matthew Vaughn,654105,Theater,1,132,"Jennifer Lawrence, Michael Fassbender",USA,English,15세,cia cia agent mutant,NA,NA,NA,"Action, Adventure, Sci-Fi"
65,Black Swan,N,KVARIETY_043,2010-01-08,Darren Aronofsky,975010,Theater,1,108,"Natalie Portman, Mila Kunis",USA,English,19금,ballerina ballet fear,NA,NA,NA,"Drama, Thriller"
66,Criminal,N,KVARIETY_066,2016-05-10,Ariel Vromen,382017,영화관,1,113,"Gary Oldman, Jordi Moll??",UK,English,19금,cia husband wife relationship memory,NA,NA,NA,"Action, Crime, Drama"
67,The Pirates! Band of Misfits,N,KDRAMA_016,2012-03-04,Peter Lord,553339,영화관,1,88,"Salma Hayek, Russell Tovey",UK,English,12세,charles darwin cutlass pirate,NA,NA,NA,"Adventure, Animation, Comedy"
68,Girl House,N,DRAMA_HORROR_GHOST,2014-12-25,Jon Knautz,21705,영화관,1,99,"Camren Bicondova, Adam DiMarco",Canada,English,전체,college student disfigured face house,NA,NA,NA,"Horror, Thriller"
69,Aroused,N,MOVIE_DOC_HISTORY,2013-03-17,Deborah Anderson,578078,Theater,1,66,"Lisa Ann, Jesse Jane",USA,English,전체,aroused photography pornography documentary,NA,NA,NA,Documentary
70,Antarctica: A Year on Ice,N,DRAMA_THR_TECH,2013-05-08,Anthony Powell,79351,영화관,1,91,"Josh Swanson, Tom Hamann",New Zealand,English,12세,antarctica,NA,NA,NA,"Adventure, Biography, Documentary"
71,Trust,N,MOVIE_ANIME_FANTASY,2010-02-17,David Schwimmer,118071,Theater,1,106,"Noah Emmerich, Jordan Trovillion",USA,English,19금,counselor fbi revenge motive,NA,NA,NA,"Crime, Drama, Thriller"
72,Never Back Down 2: The Beatdown,N,KDRAMA_072,2011-03-28,Michael Jai White,404716,Theater,1,90,"Michael Jai White, Alex Meraz",USA,English,19금,bad cop college second part,NA,NA,NA,"Action, Drama, Sport"
73,Haywire,N,KDRAMA_038,2011-11-13,Steven Soderbergh,99063,영화관,1,93,"Channing Tatum, Michael Fassbender",Ireland,English,19금,die hard scenario one woman army rescue,NA,NA,NA,"Action, Thriller"
74,1911,N,KDRAMA_056,2011-08-01,Li Zhang,229226,영화관,1,121,"Bingbing Li, Joan Chen",China,Mandarin,19금,china disarming someone qing dynasty,NA,NA,NA,"Action, Adventure, Drama"
75,Annabelle,N,KVARIETY_156,2014-03-21,John R. Leonetti,474095,Theater,1,99,"Alfre Woodard, Annabelle Wallis",USA,English,19금,horror movie prequel murder paranormal activity,NA,NA,NA,"Horror, Mystery"
76,Taken 3,N,DRAMA_GEN,2014-12-14,Olivier Megaton,218847,영화관,1,115,"Liam Neeson, Dougray Scott",France,English,15세,betrayal death final showdown,NA,NA,NA,"Action, Thriller"
77,Muppets Most Wanted,N,DRAMA_CRIME_CORRUPTION,2014-02-07,James Bobin,439324,Theater,1,119,"Ty Burrell, Tina Fey",USA,English,12세,europe frog gulag,NA,NA,NA,"Adventure, Comedy, Crime"
78,Think Like a Man Too,N,KDRAMA_055,2014-07-23,Tim Story,417449,Theater,1,106,"Romany Malco, Regina Hall",USA,English,15세,african american imperative in title las vegas nevada,NA,NA,NA,"Comedy, Romance"
79,Fun Size,N,KDRAMA_039,2012-02-17,Josh Schwartz,214620,Theater,1,86,"Thomas McDonell, Jackson Nicoll",USA,English,15세,adult humor best friend friend,NA,NA,NA,"Adventure, Comedy"
80,Cop Out,N,KDRAMA_061,2010-10-18,Kevin Smith,218182,Theater,1,107,"Bruce Willis, Tracy Morgan",USA,English,19금,baseball card detective partner,NA,NA,NA,"Action, Comedy, Crime"
81,It's a Wonderful Afterlife,N,KVARIETY_079,2010-08-22,Gurinder Chadha,138184,영화관,1,100,"Sendhil Ramamurthy, Mark Addy",UK,English,15세,afterlife indian murder,NA,NA,NA,"Comedy, Drama, Horror"
82,Furious 7,N,DRAMA_THR_POLICE,2015-06-21,James Wan,391789,Theater,1,140,"Jason Statham, Paul Walker",USA,English,15세,car falling off a cliff hospital revenge,NA,NA,NA,"Action, Crime, Thriller"
83,Dracula Untold,N,KVARIETY_137,2014-03-20,Gary Shore,334846,Theater,1,92,"Dominic Cooper, Sarah Gadon",USA,English,15세,death of wife dracula tarantula,NA,NA,NA,"Action, Drama, Fantasy"
84,Ex Machina,N,KDRAMA_015,2015-08-03,Alex Garland,391310,영화관,1,108,"Elina Alminas, Sonoya Mizuno",UK,English,19금,artificial intelligence robot robot human relationship,NA,NA,NA,"Drama, Mystery, Sci-Fi"
85,The Monuments Men,N,DRAMA_ROM_GL,2014-01-13,George Clooney,243539,Theater,1,118,"Bill Murray, Matt Damon",USA,English,15세,art art expert nazi stolen art,NA,NA,NA,"Drama, War"
86,Godzilla Resurgence,N,DRAMA_WORK_POLICE,2016-11-17,Hideaki Anno,268972,영화관,1,120,"Mark Chinnery, Shin'ya Tsukamoto",Japan,Japanese,전체,blood godzilla monster,NA,NA,NA,"Action, Adventure, Drama"
87,50/50,N,KDRAMA_002,2011-05-23,Jonathan Levine,495110,Theater,1,100,"Joseph Gordon-Levitt, Anna Kendrick",USA,English,19금,best friend cancer survival rate,NA,NA,NA,"Comedy, Drama, Romance"
88,Indie Game: The Movie,N,KDRAMA_026,2012-05-21,Lisanne Pajot,331219,영화관,1,103,"Jonathan Blow, Edmund McMillen",Canada,English,전체,movie in title,NA,NA,NA,Documentary
89,Diary of a Wimpy Kid: Rodrick Rules,N,MOVIE_DOC_HISTORY,2011-09-21,David Bowers,446790,Theater,1,99,"Zachary Gordon, Rachael Harris",USA,English,12세,brother middle school no opening credits,NA,NA,NA,"Comedy, Family"
90,Before I Go to Sleep,N,KVARIETY_160,2014-02-17,Rowan Joffe,340118,영화관,1,92,"Colin Firth, Ben Crompton",UK,English,19금,amnesia female nudity infidelity,NA,NA,NA,"Drama, Mystery, Thriller"
91,August,N,DRAMA_FANTASY_WEREWOLF,2011-10-15,Eldar Rapaport,427286,Theater,1,99,"Murray Bartlett, Adrian Gonzalez",USA,English,전체,apartment gay parent job interview,NA,NA,NA,"Drama, Romance"
92,Wanderlust,N,KVARIETY_091,2012-09-20,David Wain,239566,Theater,1,98,"Justin Theroux, Lauren Ambrose",USA,English,19금,childbirth female frontal nudity nude protest,NA,NA,NA,Comedy
93,Let's Kill Ward's Wife,N,MOVIE_ANIME_ROMANCE,2014-07-24,Scott Foley,225122,Theater,1,82,"Donald Faison, Greg Grunberg",USA,English,전체,apology death group of friends,NA,NA,NA,"Comedy, Crime"
94,30 Nights of Paranormal Activity with the Devil Inside the Girl with the Dragon Tattoo,N,KVARIETY_136,2013-12-18,Craig Moss,78159,Theater,1,80,"French Stewart, Ashley Martin",USA,English,19금,exorcism female nudity haunted house,NA,NA,NA,Comedy
95,Green Street 3: Never Back Down,N,KVARIETY_017,2013-11-01,James Nunn,147505,영화관,1,93,"Spencer Wilding, Mark Wingett",UK,English,19금,bare breasts firm hooliganism,NA,NA,NA,"Action, Drama"
96,Go for It!,N,KDRAMA_039,2011-07-24,Carmen Marron,548759,Theater,1,105,"Jossara Jinaro, Aimee Garcia",USA,English,15세,exclamation point in title imperative in title punctuation in title,NA,NA,NA,"Drama, Musical"
97,Our Brand Is Crisis,N,MOVIE_THR_CRIME,2015-06-10,David Gordon Green,260711,Theater,1,107,"Dominic Flores, Zoe Kazan",USA,English,19금,bolivia box office flop inspired by documentary,NA,NA,NA,"Comedy, Drama"
98,Fast Five,N,KDRAMA_009,2011-08-08,Justin Lin,474806,Theater,1,132,"Paul Walker, Vin Diesel",USA,English,15세,drug lord drugs federal agent,NA,NA,NA,"Action, Crime, Thriller"
99,22 Jump Street,N,MOVIE_COM_FAMILY,2014-05-08,Phil Lord,344213,Theater,1,112,"Channing Tatum, Craig Roberts",USA,English,19금,college drugs hidden camera,NA,NA,NA,"Action, Comedy, Crime"
100,Spring Breakers,N,MOVIE_SPORTS_ICE,2012-10-24,Harmony Korine,144553,Theater,1,94,"James Franco, Heather Morris",USA,English,19금,kissing a dead body repeated dialogue sex in pool,NA,NA,NA,"Crime, Drama"
101,Transcendence,N,KDRAMA_090,2014-07-08,Wally Pfister,334486,영화관,1,119,"Johnny Depp, Morgan Freeman",UK,English,15세,artificial intelligence consciousness power outage,NA,NA,NA,"Drama, Mystery, Romance"
102,Soul Surfer,N,KVARIETY_156,2011-08-08,Sean McNamara,148073,Theater,1,106,"Dennis Quaid, Chris Brochu",USA,English,12세,christian christian film shark,NA,NA,NA,"Biography, Drama, Family"
103,Krampus,N,DRAMA_CRIME_ORGANIZED,2015-11-23,Michael Dougherty,469187,Theater,1,98,"Adam Scott, Conchata Ferrell",USA,English,15세,christmas german holiday,NA,NA,NA,"Comedy, Fantasy, Horror"
104,Max,N,DRAMA_WORK_MILITARY,2015-07-05,Boaz Yakin,420033,Theater,1,111,"Jay Hernandez, Joseph Julian Soria",USA,English,12세,afghanistan death of marine dog,NA,NA,NA,"Adventure, Family"
105,Meek's Cutoff,N,KDRAMA_050,2010-04-18,Kelly Reichardt,583360,Theater,1,104,"Bruce Greenwood, Zoe Kazan",USA,English,12세,desert oregon survival,NA,NA,NA,"Drama, Western"
106,Hugo,N,MOVIE_SF_PARALLEL,2011-02-16,Martin Scorsese,440670,Theater,1,126,"Chlo?? Grace Moretz, Christopher Lee",USA,English,12세,automaton mechanical railway station,NA,NA,NA,"Adventure, Drama, Family"
107,Wreck-It Ralph,N,KDRAMA_014,2012-04-03,Rich Moore,356852,Theater,1,101,"Jack McBrayer, Sarah Silverman",USA,English,12세,arcade candy glitch,NA,NA,NA,"Adventure, Animation, Comedy"
108,The Dilemma,N,KVARIETY_067,2011-06-10,Ron Howard,472030,Theater,1,111,"Channing Tatum, Clint Howard",USA,English,15세,best friend friend investigation,NA,NA,NA,"Comedy, Drama"
109,Oz the Great and Powerful,N,MOVIE_ANIME_SF,2013-04-01,Sam Raimi,327292,Theater,1,130,"Tim Holmes, Mila Kunis",USA,English,12세,circus magic magician,NA,NA,NA,"Adventure, Family, Fantasy"
110,Kung Fu Killer,N,MOVIE_CRIME_ORGANIZED,2014-09-06,Teddy Chan,150946,영화관,1,100,"Siu-Wong Fan, Charlie Yeung",China,Cantonese,전체,fight kung fu martial arts,NA,NA,NA,"Action, Drama"
111,Dolphin Tale,N,KVARIETY_150,2011-07-11,Charles Martin Smith,359127,Theater,1,113,"Morgan Freeman, Michael Roark",USA,English,12세,boy dolphin prosthetics,NA,NA,NA,"Drama, Family"
112,"For a Good Time, Call...",N,DRAMA_SOC_CORRUPTION,2012-09-12,Jamie Travis,489704,Theater,1,88,"James Wolk, Ari Graynor",USA,English,19금,friend friendship gay,NA,NA,NA,Comedy
113,The Young Messiah,N,KVARIETY_065,2016-05-03,Cyrus Nowrasteh,193649,Theater,1,111,"Clive Russell, Vincent Walsh",USA,English,15세,based on novel,NA,NA,NA,Drama
114,Southpaw,N,DRAMA_HORROR_OCCULT,2015-04-14,Antoine Fuqua,288589,Theater,1,124,"Jake Gyllenhaal, 50 Cent",USA,English,19금,boxer boxing training death of wife,NA,NA,NA,"Drama, Sport"
115,Sherlock Holmes: A Game of Shadows,N,KDRAMA_062,2011-05-11,Guy Ritchie,502141,Theater,1,129,"Robert Downey Jr., Eddie Marsan",USA,English,15세,factory gypsy investigation,NA,NA,NA,"Action, Adventure, Crime"
116,Your Highness,N,DRAMA_ROM_LONGDIST,2011-06-21,David Gordon Green,334703,Theater,1,102,"Natalie Portman, Zooey Deschanel",USA,English,19금,knight prince quest,NA,NA,NA,"Adventure, Comedy, Fantasy"
117,Good Deeds,N,KVARIETY_032,2012-08-14,Tyler Perry,340319,Theater,1,110,"Eddie Cibrian, Phylicia Rashad",USA,English,15세,businessman fight mean brother,NA,NA,NA,"Comedy, Drama, Romance"
118,The Lost Medallion: The Adventures of Billy Stone,N,KVARIETY_122,2013-09-12,Bill Muir,247633,영화관,1,97,"Alex Kendrick, Jansen Panettiere",Thailand,English,12세,cave cobra island,NA,NA,NA,"Adventure, Family, Fantasy"
119,Harry Potter and the Deathly Hallows: Part II,N,KDRAMA_010,2011-07-25,Matt Birch,384400,영화관,1,94,"Rupert Grint, Dave Legeno",UK,English,전체,A film titled Harry Potter and the Deathly Hallows: Part II.,NA,NA,NA,"Action, Fantasy"
120,Airlift,N,DRAMA_SOC_CLASS,2016-06-10,Raja Menon,104079,영화관,1,130,"Nimrat Kaur, Sameer Ali Khan",India,Hindi,전체,1990s businessman evacuation,NA,NA,NA,"Action, Drama, History"
121,Survivor,N,DRAMA_SF_CYBERPUNK,2015-02-15,James McTeigue,238463,Theater,1,96,"Milla Jovovich, Roger Rees",USA,English,15세,cigarette lighter death fire,NA,NA,NA,"Action, Crime, Thriller"
122,Date Night,N,DRAMA_ROM_GL,2010-09-18,Shawn Levy,254897,Theater,1,101,"Mila Kunis, James Franco",USA,English,15세,city new york city night,NA,NA,NA,"Comedy, Crime, Romance"
123,Firestorm,N,MOVIE_DOC_POLITICS,2013-01-06,Alan Yuen,292180,영화관,1,118,"Andy Lau, Michael Wong",China,Mandarin,전체,die hard scenario gunfight hong kong police,NA,NA,NA,"Action, Crime, Thriller"
124,Diary of a Wimpy Kid: Dog Days,N,KVARIETY_075,2012-10-10,David Bowers,480398,Theater,1,94,"Zachary Gordon, Rachael Harris",USA,English,12세,best friend camping country club,NA,NA,NA,"Comedy, Family"
125,Fantastic Four,N,KVARIETY_067,2015-11-21,Josh Trank,237874,Theater,1,100,"Tim Blake Nelson, Reg E. Cathey",USA,English,15세,box office flop critically bashed portal,NA,NA,NA,"Action, Adventure, Sci-Fi"
126,Snow Queen,N,KDRAMA_072,2012-06-04,Vladlen Barbe,331852,영화관,1,80,"Erin Fitzgerald, Wendee Lee",Russia,Russian,12세,3d,NA,NA,NA,"Adventure, Animation, Family"
127,The Theory of Everything,N,KVARIETY_120,2014-12-20,James Marsh,431564,영화관,1,123,"Eddie Redmayne, Emily Watson",UK,English,15세,based on memoir cambridge university husband wife relationship,NA,NA,NA,"Biography, Drama, Romance"
128,Let Me In,N,KVARIETY_135,2010-06-15,Matt Reeves,450160,영화관,1,116,"Chlo?? Grace Moretz, Dylan Minnette",UK,English,19금,blood boy night,NA,NA,NA,"Drama, Fantasy, Horror"
129,Young Adult,N,KDRAMA_084,2011-07-09,Jason Reitman,286582,Theater,1,94,"Charlize Theron, Patton Oswalt",USA,English,19금,car damage computer printer female band,NA,NA,NA,"Comedy, Drama"
130,The Internship,N,KVARIETY_090,2013-12-02,Shawn Levy,460068,Theater,1,125,"Josh Gad, Jessica Szohr",USA,English,15세,actor's picture shown in credits animated credits google,NA,NA,NA,Comedy
131,The Angry Birds Movie,N,DRAMA_ACTION_SPY,2016-09-15,Clay Kaytis,268404,Theater,1,97,"Peter Dinklage, Josh Gad",USA,English,12세,butt downward duck fish,NA,NA,NA,"Action, Animation, Comedy"
