id,content_name,is_ott,분류코드,개봉일,감독_및_PD,시청자수,platform,episode_total,episode_length,cast,origin_country,lang,rating,synopsis,poster_url,ott_availability,awards,tags
781,Paranormal Activity 2,N,MOVIE_ANIME_SLICEOFLIFE,2010-10-28,Tod Williams,180189,Theater,1,98,"Sprague Grayden, Molly Ephraim",USA,English,19금,california carlsbad california house,NA,NA,NA,Horror
782,The Legend of Tarzan,N,KDRAMA_030,2016-09-18,David Yates,455845,Theater,1,110,"Christoph Waltz, Alexander Skarsg??rd",USA,English,15세,africa capture jungle,NA,NA,NA,"Action, Adventure, Drama"
783,Abduction,N,KVARIETY_154,2011-04-08,John Singleton,576660,Theater,1,106,"Ken Arnold, Benjamin J. Cain Jr.",USA,English,15세,assassin high school on the run,NA,NA,NA,"Action, Mystery, Thriller"
784,Of Horses and Men,N,DRAMA_WORK_EDUCATION,2013-07-28,Benedikt Erlingsson,407490,영화관,1,81,"Ingvar Eggert Sigur?°sson, Charlotte B?¸ving",Iceland,Icelandic,전체,barbed wire barbed wire fence horse,NA,NA,NA,"Comedy, Drama, Romance"
785,Battle of the Year,N,MOVIE_ANIME_MYSTERY,2013-05-07,Benson Lee,324524,Theater,1,110,"Chris Brown, Caity Lotz",USA,English,15세,3 dimensional box office flop critically bashed,NA,NA,NA,"Drama, Music"
786,We Need to Talk About Kevin,N,DRAMA_HORROR_ZOMBIE,2011-12-25,Lynne Ramsay,208857,영화관,1,112,"Ezra Miller, Siobhan Fallon Hogan",UK,English,19금,archery defiance mental illness,NA,NA,NA,"Drama, Thriller"
787,Open Road,N,MOVIE_THR_LEGAL,2013-05-15,Marcio Garcia,91700,영화관,1,85,"John Savage, Kristi Clainos",Brazil,English,전체,dealer drugs killer,NA,NA,NA,"Action, Drama, Thriller"
788,Aloha,N,KVARIETY_128,2015-04-16,Cameron Crowe,233298,Theater,1,105,"Emma Stone, Bradley Cooper",USA,English,15세,box office flop critically bashed hawaii,NA,NA,NA,"Comedy, Drama, Romance"
789,Ramona and Beezus,N,KVARIETY_111,2010-11-12,Elizabeth Allen Rosenbaum,512615,Theater,1,103,"Sierra McCormick, Hutch Dano",USA,English,전체,aunt cat death of pet,NA,NA,NA,"Adventure, Comedy, Family"
790,The Last Song,N,KDRAMA_028,2010-07-16,Julie Anne Robinson,578314,Theater,1,107,"Kelly Preston, Bobby Coleman",USA,English,12세,beach fire love,NA,NA,NA,"Drama, Family, Music"
791,Straight A's,N,KVARIETY_046,2013-07-14,James Cox,168990,Theater,1,91,"Jon Mack, Powers Boothe",USA,English,19금,addict paternity rascal,NA,NA,NA,"Comedy, Drama"
792,A Better Life,N,KVARIETY_124,2011-09-10,Chris Weitz,310176,Theater,1,98,"Demi?¡n Bichir, Eddie 'Piolin' Sotelo",USA,English,15세,gang gardener money,NA,NA,NA,"Drama, Romance"
793,The Rise of the Krays,N,KVARIETY_068,2015-05-16,Zackary Adler,197552,영화관,1,110,"Simon Merrells, Kevin Leslie",UK,English,19금,A film titled The Rise of the Krays.,NA,NA,NA,"Crime, Drama"
794,Final Destination 5,N,KVARIETY_007,2011-08-16,Steven Quale,307753,Theater,1,92,"Emma Bell, Jacqueline MacInnes Wood",USA,English,19금,blood splatter death eyeball run over by car,NA,NA,NA,Horror
795,The Raid: Redemption,N,KVARIETY_093,2011-04-17,Gareth Evans,381370,영화관,1,102,"Iko Uwais, Yayan Ruhian",Indonesia,Indonesian,19금,apartment drug lord gangster,NA,NA,NA,"Action, Crime, Thriller"
796,Detention,N,DRAMA_WORK_LAWENFORCEMENT,2011-01-27,Joseph Kahn,411098,Theater,1,93,"Josh Hutcherson, Shanley Caswell",USA,English,19금,blood splatter detention high school,NA,NA,NA,"Comedy, Horror, Sci-Fi"
797,Hard to Be a God,N,DRAMA_HORROR_SLASHER,2013-12-17,Aleksey German,471971,영화관,1,177,"Leonid Yarmolnik, Yuriy Tsurilo",Russia,Russian,전체,fictional war hanging male full frontal nudity,NA,NA,NA,"Drama, Sci-Fi"
798,Rango,N,KVARIETY_200,2011-09-06,Gore Verbinski,216120,Theater,1,107,"Johnny Depp, Ray Winstone",USA,English,12세,chameleon lizard sheriff,NA,NA,NA,"Adventure, Animation, Comedy"
799,Jane Got a Gun,N,KVARIETY_076,2016-09-14,Gavin O'Connor,426654,Theater,1,98,"Natalie Portman, Noah Emmerich",USA,English,19금,brothel death of husband ex lover,NA,NA,NA,"Action, Drama, Western"
800,Stake Land,N,DRAMA_THR_PSYCHO,2010-10-25,Jim Mickle,387171,Theater,1,98,"Connor Paolo, Michael Cerveris",USA,English,19금,canada post apocalypse road movie,NA,NA,NA,"Drama, Horror, Sci-Fi"
801,The Tempest,N,KDRAMA_016,2010-07-08,Julie Taymor,464644,Theater,1,110,"Djimon Hounsou, Reeve Carney",USA,English,15세,banishment sorcery spirit,NA,NA,NA,"Comedy, Drama, Fantasy"
802,Dom Hemingway,N,DRAMA_SCHOOL_GEN,2013-03-05,Richard Shepard,300622,영화관,1,93,"Richard E. Grant, Mark Wingett",UK,English,19금,male frontal nudity male nudity male rear nudity,NA,NA,NA,"Comedy, Crime, Drama"
803,Jab Tak Hai Jaan,N,KDRAMA_067,2012-01-14,Yash Chopra,559955,영화관,1,176,"Shah Rukh Khan, Katrina Kaif",India,Hindi,전체,accident army bomb,NA,NA,NA,"Drama, Romance"
804,Guardians of the Galaxy,N,MOVIE_FANTASY_MYTH,2014-07-14,James Gunn,789862,Theater,1,121,"Bradley Cooper, Vin Diesel",USA,English,15세,bounty hunter outer space raccoon,NA,NA,NA,"Action, Adventure, Sci-Fi"
805,London Has Fallen,N,MOVIE_SPORTS_OLYMPICS,2016-04-22,Babak Najafi,409911,영화관,1,99,"Gerard Butler, Radha Mitchell",UK,English,19금,british funeral good versus evil,NA,NA,NA,"Action, Crime, Drama"
806,The Man with the Iron Fists,N,DRAMA_SF_SUPERHUMAN,2012-04-03,RZA,159351,Theater,1,107,"Rick Yune, RZA",USA,English,19금,blacksmith box office flop chop socky,NA,NA,NA,Action
807,The 5th Quarter,N,DRAMA_WORK_FINANCE,2010-07-13,Rick Bieber,100110,Theater,1,90,"Aidan Quinn, Kendrick Cross",USA,English,12세,athletic training football practice funeral,NA,NA,NA,"Biography, Drama, Sport"
808,Wall Street: Money Never Sleeps,N,KVARIETY_030,2010-07-25,Oliver Stone,102297,Theater,1,136,"Frank Langella, Austin Pendleton",USA,English,15세,corporate greed crisis economy,NA,NA,NA,Drama
809,Despicable Me 2,N,KDRAMA_025,2013-03-18,Pierre Coffin,516125,Theater,1,98,"Steve Carell, Miranda Cosgrove",USA,English,12세,dating minion overprotective father,NA,NA,NA,"Animation, Comedy, Family"
810,The Green Hornet,N,KVARIETY_026,2011-02-24,Michel Gondry,543279,Theater,1,119,"Christoph Waltz, Tom Wilkinson",USA,English,15세,heir kung fu party,NA,NA,NA,"Action, Comedy, Crime"
811,Fight to the Finish,N,MOVIE_COM_ROM,2016-06-26,Warren Sheppard,309043,Theater,1,94,"Jennifer Hale, Randy Jay Burrell",USA,English,15세,fighting karate,NA,NA,NA,"Action, Romance, Sport"
812,The Interview,N,DRAMA_THR_SUPERNATURAL,2014-09-16,Evan Goldberg,499175,Theater,1,112,"James Franco, Randall Park",USA,English,19금,assassination attempt communist dictatorship dictator,NA,NA,NA,Comedy
813,Small Apartments,N,MOVIE_DOC_HISTORY,2012-06-06,Jonas ?kerlund,372870,Theater,1,96,"Noel Gugliemi, Saffron Burrows",USA,English,19금,fire investigator landlord suicide,NA,NA,NA,"Comedy, Crime, Drama"
814,R.I.P.D.,N,MOVIE_CRIME_CYBER,2013-01-14,Robert Schwentke,109663,Theater,1,96,"Ryan Reynolds, Jeff Bridges",USA,English,15세,drug dealer gold partner,NA,NA,NA,"Action, Comedy, Fantasy"
815,The Witch,N,KVARIETY_063,2015-05-16,Robert Eggers,132414,Theater,1,92,"Julian Richings, Kate Dickie",USA,English,19금,black magic goat isolation,NA,NA,NA,"Horror, Mystery"
816,Ted 2,N,KVARIETY_193,2015-06-03,Seth MacFarlane,183677,Theater,1,125,"Liam Neeson, Morgan Freeman",USA,English,19금,baby f word fight,NA,NA,NA,Comedy
817,H.,N,KVARIETY_008,2014-07-17,Rania Attieh,262240,Theater,1,93,"Paul Hickert, Robin Bartlett",USA,English,전체,A film titled H..,NA,NA,NA,"Drama, Sci-Fi, Thriller"
818,Stories of Our Lives,N,MOVIE_ANIME_HISTORICAL,2014-08-27,Jim Chuchu,23862,영화관,1,60,"Paul Ogola, Olwenya Maina",Kenya,Swahili,전체,A film titled Stories of Our Lives.,NA,NA,NA,Drama
819,Pirates of the Caribbean: On Stranger Tides,N,DRAMA_ROM_SECONDCHANCE,2011-11-15,Rob Marshall,461037,Theater,1,136,"Johnny Depp, Sam Claflin",USA,English,15세,blackbeard captain pirate,NA,NA,NA,"Action, Adventure, Fantasy"
820,In Time,N,KVARIETY_193,2011-08-14,Andrew Niccol,321751,Theater,1,109,"Matt Bomer, Olivia Wilde",USA,English,15세,currency future murder,NA,NA,NA,"Action, Sci-Fi, Thriller"
821,Sinister 2,N,MOVIE_ANIME_CULINARY,2015-12-17,Ciar?¡n Foy,306848,Theater,1,97,"Laila Haley, James Ransone",USA,English,19금,deputy farmhouse nightmare,NA,NA,NA,"Horror, Mystery, Thriller"
822,Neighbors,N,KDRAMA_091,2014-02-27,Nicholas Stoller,222881,Theater,1,97,"Craig Roberts, Carla Gallo",USA,English,19금,broken leg friendship jewish,NA,NA,NA,Comedy
823,Need for Speed,N,KVARIETY_052,2014-09-02,Scott Waugh,411324,Theater,1,132,"Rami Malek, Dominic Cooper",USA,English,15세,cross country custom car illegal street racing,NA,NA,NA,"Action, Crime, Drama"
824,Warrior,N,MOVIE_GEN,2011-07-18,Gavin O'Connor,533708,Theater,1,140,"Tom Hardy, Frank Grillo",USA,English,15세,alcoholic mixed martial arts return home,NA,NA,NA,"Drama, Sport"
825,Unbroken,N,KDRAMA_066,2014-10-20,Angelina Jolie Pitt,278929,Theater,1,137,"Finn Wittrock, Jack O'Connell",USA,English,15세,emaciation male nudity plane crash,NA,NA,NA,"Biography, Drama, Sport"
826,Atlas Shrugged: Who Is John Galt?,N,DRAMA_SOC_DISABILITY,2014-07-03,James Manera,188396,Theater,1,99,"Joaquim de Almeida, Greg Germann",USA,English,15세,box office flop critically bashed economy,NA,NA,NA,"Drama, Mystery, Sci-Fi"
827,Do You Believe?,N,KDRAMA_063,2015-12-04,Jon Gunn,43549,Theater,1,120,"Alexa PenaVega, Delroy Lindo",USA,English,15세,belief faith pastor,NA,NA,NA,Drama
828,A Walk Among the Tombstones,N,MOVIE_SPORTS_SURFING,2014-08-19,Scott Frank,431206,Theater,1,114,"Liam Neeson, Boyd Holbrook",USA,English,19금,drug dealer ex cop murder of wife,NA,NA,NA,"Crime, Drama, Mystery"
829,Filly Brown,N,KVARIETY_082,2012-10-01,Youssef Delara,338754,Theater,1,80,"Noel Gugliemi, Jenni Rivera",USA,English,19금,A film titled Filly Brown.,NA,NA,NA,"Drama, Music"
830,The Fault in Our Stars,N,KVARIETY_067,2014-08-28,Josh Boone,306377,Theater,1,133,"Shailene Woodley, Sam Trammell",USA,English,15세,cancer falling in love friendship,NA,NA,NA,"Drama, Romance"
831,Hot Pursuit,N,MOVIE_COM_SATIRE,2015-08-21,Anne Fletcher,530889,Theater,1,87,"Jim Gaffigan, Richard T. Jones",USA,English,15세,danger drug cartel female cop,NA,NA,NA,"Action, Comedy, Crime"
832,Restoration,N,KDRAMA_011,2016-08-04,Zack Ward,411399,Theater,1,92,"Zack Ward, Anna Harr",USA,English,전체,A film titled Restoration.,NA,NA,NA,Horror
833,High Road,N,KDRAMA_035,2011-04-13,Matt Walsh,166197,Theater,1,87,"Joe Lo Truglio, Matt Jones",USA,English,19금,A film titled High Road.,NA,NA,NA,Comedy
834,Gulliver's Travels,N,KDRAMA_021,2010-12-03,Rob Letterman,127095,Theater,1,85,"James Corden, Catherine Tate",USA,English,12세,bermuda triangle box office hit shipwrecked,NA,NA,NA,"Adventure, Comedy, Family"
835,Midnight in Paris,N,DRAMA_WORK_MILITARY,2011-11-19,Woody Allen,412399,영화관,1,94,"Kurt Fuller, Audrey Fleurot",Spain,English,15세,1920s golden age midnight,NA,NA,NA,"Comedy, Fantasy, Romance"
836,The Last Exorcism Part II,N,MOVIE_FAM_STEPFAMILY,2013-02-03,Ed Gass-Donnelly,122979,영화관,1,93,"Muse Watson, Spencer Treat Clark",France,English,15세,car fire evil hospital,NA,NA,NA,"Drama, Horror, Thriller"
837,Evil Dead,N,MOVIE_SPORTS_ICE,2013-06-13,Fede Alvarez,321065,Theater,1,96,"Lou Taylor Pucci, Elizabeth Blackmore",USA,English,19금,book of the dead demon h.p. lovecraft,NA,NA,NA,Horror
838,Deceptive Practice: The Mysteries and Mentors of Ricky Jay,N,DRAMA_ACTION_CAR,2012-02-08,Molly Bernstein,88623,Theater,1,88,"David Mamet, Ricky Jay",USA,English,전체,stage magician,NA,NA,NA,Documentary
839,Let's Be Cops,N,KDRAMA_026,2014-03-24,Luke Greenfield,116841,Theater,1,104,"Rob Riggle, Damon Wayans Jr.",USA,English,19금,friendship between men impersonating a police officer mobster,NA,NA,NA,Comedy
840,The Big Short,N,DRAMA_HORROR_GHOST,2015-03-22,Adam McKay,593932,Theater,1,130,"Ryan Gosling, Christian Bale",USA,English,19금,bank banking finance,NA,NA,NA,"Biography, Comedy, Drama"
841,A Good Day to Die Hard,N,KVARIETY_103,2013-11-14,John Moore,255098,Theater,1,101,"Bruce Willis, Cole Hauser",USA,English,19금,bomb cia courthouse,NA,NA,NA,"Action, Thriller"
842,Weekend,N,KVARIETY_067,2011-12-17,Andrew Haigh,282863,영화관,1,97,"Tom Cullen, Chris New",UK,English,전체,coming out fellatio male in bathtub,NA,NA,NA,"Drama, Romance"
843,Fight Valley,N,KVARIETY_164,2016-07-22,Rob Hawk,77333,Theater,1,90,"Kari J. Kramer, Erin O'Brien",USA,English,전체,A film titled Fight Valley.,NA,NA,NA,"Action, Drama"
844,"Ultramarines: A Warhammer 40,000 Movie",N,MOVIE_DOC_HISTORY,2010-05-06,Martyn Pick,98157,영화관,1,76,"Sean Pertwee, Steven Waddington",UK,English,19금,grimdark mutilated corpse space marine,NA,NA,NA,"Action, Animation, Fantasy"
845,No Escape,N,MOVIE_SPORTS_BOXING,2015-07-28,John Erick Dowdle,101341,Theater,1,103,"Sterling Jerins, Claire Geare",USA,English,19금,asia fictional country hotel,NA,NA,NA,"Action, Thriller"
846,Misconduct,N,KVARIETY_044,2016-09-26,Shintaro Shimosawa,105453,Theater,1,106,"Al Pacino, Anthony Hopkins",USA,English,19금,black panties lust sexual attraction,NA,NA,NA,"Drama, Thriller"
847,Bending Steel,N,KVARIETY_089,2013-02-27,Dave Carroll,451068,Theater,1,92,Chris 'Wonder' Schoeck,USA,English,전체,A film titled Bending Steel.,NA,NA,NA,Documentary
848,The Ridges,N,DRAMA_FAM_ELDERLY,2011-10-01,Brandon Landers,452233,Theater,1,143,"Robbie Barnes, Alana Kaniewski",USA,English,전체,avatar college death,NA,NA,NA,"Drama, Horror, Thriller"
849,Man of Steel,N,KVARIETY_184,2013-07-02,Zack Snyder,945759,Theater,1,143,"Henry Cavill, Christopher Meloni",USA,English,15세,based on comic book british actor playing american character final battle,NA,NA,NA,"Action, Adventure, Fantasy"
850,The Fighter,N,KVARIETY_112,2010-07-08,David O. Russell,466033,Theater,1,116,"Christian Bale, Jack McGee",USA,English,19금,boxer boxing boxing match,NA,NA,NA,"Biography, Drama, Sport"
851,Endless Love,N,KVARIETY_188,2014-06-28,Shana Feste,198973,Theater,1,104,"Alex Pettyfer, Bruce Greenwood",USA,English,15세,brother sister relationship high school graduation love,NA,NA,NA,"Drama, Romance"
852,Death Note,N,MOVIE_ACTION_WAR,2022-02-28,NA,810036,TV,13,24,NA,Japan,Japanese,12세,"A shinigami, as a god of death, can kill any personprovided they see their victim's face and write their victim's name in a notebook called a Death Note. One day, Ryuk, bored by the shinigami lifestyle and interested in seeing how a human would use a Death Note, drops one into the human realm.",,,,
853,Fullmetal Alchemist: Brotherhood,N,KVARIETY_123,2010-05-14,NA,1008675,TV,24,23,NA,Japan,Japanese,12세,"""In order for something to be obtained, something of equal value must be lost.""",,,,
854,Shokugeki no Souma,N,MOVIE_MUSIC_CONCERT,2015-05-12,NA,795885,TV,24,24,NA,Japan,Japanese,15세,"Ever since he was a child, fifteen-year-old Souma Yukihira has helped his father by working as the sous chef in the restaurant his father runs and owns. Throughout the years, Souma developed a passion for entertaining his customers with his creative, skilled, and daring culinary creations. His dream is to someday own his family's restaurant as its head chef.",,,,
855,Fate/stay night: Unlimited Blade Works,N,KVARIETY_051,2013-03-20,NA,708128,TV,13,25,NA,Japan,Japanese,12세,"The Holy Grail War is a battle royale among seven magi who serve as Masters. Masters, through the use of the command seals they are given when they enter the war, command Heroic Spirits known as Servants to fight for them in battle. In the Fifth Holy Grail War, Rin Toosaka is among the magi entering the competition. With her Servant, Archer, she hopes to obtain the ultimate prizethe Holy Grail, a magical artifact capable of granting its wielder any wish.",,,,
856,Shigatsu wa Kimi no Uso,N,MOVIE_FANTASY_GRIMREAPER,2019-11-02,NA,866554,TV,24,25,NA,Japan,Japanese,15세,"Music accompanies the path of the human metronome, the prodigious pianist Kousei Arima. But after the passing of his mother, Saki Arima, Kousei falls into a downward spiral, rendering him unable to hear the sound of his own piano.",,,,
857,Kobayashi-san Chi no Maid Dragon,N,KDRAMA_028,2020-12-14,NA,746007,TV,24,24,NA,Japan,Japanese,15세,"As Kobayashi sets off for another day at work, she opens her apartment door only to be met by an unusually frightening sightthe head of a dragon, staring at her from across the balcony. The dragon immediately transforms into a cute, busty, and energetic young girl dressed in a maid outfit, introducing herself as Tooru.",,,,
858,Boku no Hero Academia,N,KVARIETY_186,2018-03-02,NA,675524,TV,12,24,NA,Japan,Japanese,15세,"The appearance of ""quirks,"" newly discovered super powers, has been steadily increasing over the years, with 80 percent of humanity possessing various abilities from manipulation of elements to shapeshifting. This leaves the remainder of the world completely powerless, and Izuku Midoriya is one such individual.",,,,
859,Tengen Toppa Gurren Lagann,N,KVARIETY_048,2012-06-18,NA,822800,TV,24,25,NA,Japan,Japanese,15세,"Simon and Kamina were born and raised in a deep, underground village, hidden from the fabled surface. Kamina is a free-spirited loose cannon bent on making a name for himself, while Simon is a timid young boy with no real aspirations. One day while excavating the earth, Simon stumbles upon a mysterious object that turns out to be the ignition key to an ancient artifact of war, which the duo dubs Lagann. Using their new weapon, Simon and Kamina fend off a surprise attack from the surface with the help of Yoko Littner, a hot-blooded redhead wielding a massive gun who wanders the world above.",,,,
860,Boku dake ga Inai Machi,N,MOVIE_SPORTS_SURFING,2021-03-03,NA,972215,TV,12,24,NA,Japan,Japanese,12세,"When tragedy is about to strike, Satoru Fujinuma finds himself sent back several minutes before the accident occurs. The detached, 29-year-old manga artist has taken advantage of this powerful yet mysterious phenomenon, which he calls ""Revival,"" to save many lives.",,,,
861,Kyoukai no Kanata,N,KVARIETY_031,2020-01-09,NA,668955,TV,24,25,NA,Japan,Japanese,15세,"Mirai Kuriyama is the sole survivor of a clan of Spirit World warriors with the power to employ their blood as weapons. As such, Mirai is tasked with hunting down and killing ""youmu""creatures said to be the manifestation of negative human emotions. One day, while deep in thought on the school roof, Mirai comes across Akihito Kanbara, a rare half-breed of youmu in human form. In a panicked state, she plunges her blood saber into him only to realize that he's an immortal being. From then on, the two form an impromptu friendship that revolves around Mirai constantly trying to kill Akihito, in an effort to boost her own wavering confidence as a Spirit World warrior. Eventually, Akihito also manages to convince her to join the Literary Club, which houses two other powerful Spirit World warriors, Hiroomi and Mitsuki Nase.",,,,
862,New Game!,N,MOVIE_CRIME_HOSTAGE,2021-04-11,NA,732540,TV,12,23,NA,Japan,Japanese,15세,"Since childhood, Aoba Suzukaze has loved the Fairies Story game series, particularly the character designs. So when she graduates from high school, it is no surprise that she applies to work at Eagle Jump, the company responsible for making her favorite video game. On her first day, she is excited to learn that she will be working on a new installment to the series: Fairies Story 3and even more so under Kou Yagami, the lead character designer.",,,,
863,No Game No Life,N,DRAMA_SOC_POLITICS,2024-11-20,NA,800806,TV,12,24,NA,Japan,Japanese,15세,"No Game No Life is a surreal comedy that follows Sora and Shiro, shut-in NEET siblings and the online gamer duo behind the legendary username ""Blank."" They view the real world as just another lousy game; however, a strange e-mail challenging them to a chess match changes everythingthe brother and sister are plunged into an otherworldly realm where they meet Tet, the God of Games.",,,,
864,Houseki no Kuni (TV),N,KDRAMA_100,2024-09-11,NA,712056,TV,12,23,NA,Japan,Japanese,15세,"In the distant future, a new immortal and genderless life form called Gems populate the Earth. The 28 Gems must fight against the Lunarians, who attack them regularly to abduct them and to turn them into decorations. Each Gem is assigned a role, such as a fighter or a medic.",,,,
865,Kiznaiver,N,KVARIETY_049,2021-09-23,NA,667706,TV,24,23,NA,Japan,Japanese,15세,"Katsuhira Agata is a quiet and reserved teenage boy whose sense of pain has all but vanished. His friend, Chidori Takashiro, can only faintly remember the days before Katsuhira had undergone this profound change. Now, his muffled and complacent demeanor make Katsuhira a constant target for bullies, who exploit him for egregious sums of money. But their fists only just manage to make him blink, as even emotions are far from his grasp.",,,,
866,Nanatsu no Taizai,N,DRAMA_MEDICAL_SURGERY,2012-01-28,NA,898586,TV,24,24,NA,Japan,Japanese,15세,"In a world similar to the European Middle Ages, the feared yet revered Holy Knights of Britannia use immensely powerful magic to protect the region of Britannia and its kingdoms. However, a small subset of the Knights supposedly betrayed their homeland and turned their blades against their comrades in an attempt to overthrow the ruler of Liones. They were defeated by the Holy Knights, but rumors continued to persist that these legendary knights, called the ""Seven Deadly Sins,"" were still alive. Ten years later, the Holy Knights themselves staged a coup d?tat, and thus became the new, tyrannical rulers of the Kingdom of Liones.",,,,
867,Mahoutsukai no Yome,N,MOVIE_ROM_GEN,2021-05-18,NA,884132,TV,12,23,NA,Japan,Japanese,15세,"Chise Hatori, a 15-year-old Japanese girl, was sold for five million pounds at an auction to a tall masked gentleman. Abandoned at a young age and ridiculed by her peers for her unconventional behavior, she was ready to give herself to any buyer if it meant having a place to go home to. In chains and on her way to an unknown fate, she hears whispers from robed men along her path, gossiping and complaining that such a buyer got his hands on a rare ""Sleigh Beggy.""",,,,
868,Kill la Kill,N,KVARIETY_164,2019-06-17,NA,920507,TV,24,23,NA,Japan,Japanese,15세,"After the murder of her father, Ryuuko Matoi has been wandering the land in search of his killer. Following her only leadthe missing half of his invention, the Scissor Bladeshe arrives at the prestigious Honnouji Academy, a high school unlike any other. The academy is ruled by the imposing and cold-hearted student council president Satsuki Kiryuuin alongside her powerful underlings, the Elite Four. In the school's brutally competitive hierarchy, Satsuki bestows upon those at the top special clothes called ""Goku Uniforms,"" which grant the wearer unique superhuman abilities. ",,,,
869,Shingeki no Kyojin,N,KDRAMA_013,2011-08-04,NA,745159,TV,13,23,NA,Japan,Japanese,12세,"Centuries ago, mankind was slaughtered to near extinction by monstrous humanoid creatures called titans, forcing humans to hide in fear behind enormous concentric walls. What makes these giants truly terrifying is that their taste for human flesh is not born out of hunger but what appears to be out of pleasure. To ensure their survival, the remnants of humanity began living within defensive barriers, resulting in one hundred years without a single titan encounter. However, that fragile calm is soon shattered when a colossal titan manages to breach the supposedly impregnable outer wall, reigniting the fight for survival against the man-eating abominations.",,,,
870,Akame ga Kill!,N,KVARIETY_156,2012-11-09,NA,886070,TV,24,24,NA,Japan,Japanese,12세,"Night Raid is the covert assassination branch of the Revolutionary Army, an uprising assembled to overthrow Prime Minister Honest, whose avarice and greed for power has lead him to take advantage of the child emperor's inexperience. Without a strong and benevolent leader, the rest of the nation is left to drown in poverty, strife, and ruin. Though the Night Raid members are all experienced killers, they understand that taking lives is far from commendable and that they will likely face retribution as they mercilessly eliminate anyone who stands in the revolution's way.",,,,
871,One Punch Man,N,DRAMA_MYST_HISTORICAL,2014-06-14,NA,1036604,TV,12,24,NA,Japan,Japanese,12세,"The seemingly ordinary and unimpressive Saitama has a rather unique hobby: being a hero. In order to pursue his childhood dream, he trained relentlessly for three yearsand lost all of his hair in the process. Now, Saitama is incredibly powerful, so much so that no enemy is able to defeat him in battle. In fact, all it takes to defeat evildoers with just one punch has led to an unexpected problemhe is no longer able to enjoy the thrill of battling and has become quite bored.",,,,
872,Dungeon ni Deai wo Motomeru no wa Machigatteiru Darou ka,N,KVARIETY_151,2014-05-04,NA,868623,TV,24,25,NA,Japan,Japanese,15세,"Life in the bustling city of Orario is never dull, especially for Bell Cranel, a na?ve young man who hopes to become the greatest adventurer in the land. After a chance encounter with the lonely goddess, Hestia, his dreams become a little closer to reality. With her support, Bell embarks on a fantastic quest as he ventures deep within the city's monster-filled catacombs, known only as the ""Dungeon."" Death lurks around every corner in the cavernous depths of this terrifying labyrinth, and a mysterious power moves amidst the shadows.",,,,
